{
  "$schema": "https://json-schema.org/draft/2020-12/schema",
  "$id": "https://theangrybyrd.github.io/fsharp2/conformance/schemas/v1/inventory.schema.json",
  "title": "FSharp2 conformance inventory v1",
  "type": "object",
  "additionalProperties": false,
  "required": ["schemaVersion", "inventoryId", "family", "caseIds", "positiveCaseIds", "negativeCaseIds", "featureRows", "languageVersions", "optionCells", "artifactKinds", "probeKinds", "review"],
  "properties": {
    "schemaVersion": { "const": 1 },
    "inventoryId": { "type": "string", "pattern": "^[a-z][a-z0-9.-]+$" },
    "family": { "type": "string", "pattern": "^[a-z][a-z0-9.-]+$" },
    "caseIds": { "type": "array", "minItems": 1, "uniqueItems": true, "items": { "type": "string" } },
    "positiveCaseIds": { "type": "array", "uniqueItems": true, "items": { "type": "string" } },
    "negativeCaseIds": { "type": "array", "uniqueItems": true, "items": { "type": "string" } },
    "featureRows": { "type": "array", "uniqueItems": true, "items": { "type": "string" } },
    "languageVersions": { "type": "array", "minItems": 1, "uniqueItems": true, "items": { "type": "string" } },
    "optionCells": { "type": "array", "minItems": 1, "uniqueItems": true, "items": { "type": "string" } },
    "artifactKinds": { "type": "array", "uniqueItems": true, "items": { "type": "string" } },
    "probeKinds": { "type": "array", "uniqueItems": true, "items": { "type": "string" } },
    "review": { "$ref": "#/$defs/review" }
  },
  "$defs": {
    "review": {
      "type": "object",
      "additionalProperties": false,
      "required": ["owner", "sourceIssue", "reviewCondition"],
      "properties": {
        "owner": { "type": "string", "minLength": 1 },
        "sourceIssue": { "type": "string", "pattern": "^#[0-9]+$" },
        "reviewCondition": { "type": "string", "minLength": 1 }
      }
    }
  }
}
